[
  {
    "care_history_id": "3cc1cb30-3b83-5db2-97fb-468918adc310",
    "customer_product_id": "793af8f4-0a3d-5733-b079-b9d54b9d8d49",
    "care_type": "REGULAR_INSPECTION",
    "performed_on": "2026-02-26",
    "result": "NORMAL",
    "note": "합성 regular_inspection 이력",
    "data_classification": "synthetic"
  },
  {
    "care_history_id": "cab4b71f-0099-5299-85c2-543837525348",
    "customer_product_id": "793af8f4-0a3d-5733-b079-b9d54b9d8d49",
    "care_type": "FILTER_REPLACEMENT",
    "performed_on": "2026-04-12",
    "result": "FILTER_REPLACED",
    "note": "합성 filter_replacement 이력",
    "data_classification": "synthetic"
  },
  {
    "care_history_id": "62d12764-9d53-559d-8bd6-459d24b6c4bd",
    "customer_product_id": "e8e9bca4-a0a2-53e4-8cdd-dac2415a8074",
    "care_type": "REGULAR_INSPECTION",
    "performed_on": "2026-03-05",
    "result": "NORMAL",
    "note": "합성 regular_inspection 이력",
    "data_classification": "synthetic"
  },
  {
    "care_history_id": "e8e5c5a4-7077-58f9-9112-5898d8ab893b",
    "customer_product_id": "e8e9bca4-a0a2-53e4-8cdd-dac2415a8074",
    "care_type": "FILTER_REPLACEMENT",
    "performed_on": "2026-04-19",
    "result": "FILTER_REPLACED",
    "note": "합성 filter_replacement 이력",
    "data_classification": "synthetic"
  },
  {
    "care_history_id": "5218dcb7-e9ac-57c7-9dcf-752f70bac6f7",
    "customer_product_id": "9f61b804-1cb4-5c0e-b58f-f9999bf0cbb4",
    "care_type": "REGULAR_INSPECTION",
    "performed_on": "2026-03-12",
    "result": "NORMAL",
    "note": "합성 regular_inspection 이력",
    "data_classification": "synthetic"
  },
  {
    "care_history_id": "c4b2a649-3d53-5604-8fb2-08961472467f",
    "customer_product_id": "9f61b804-1cb4-5c0e-b58f-f9999bf0cbb4",
    "care_type": "FILTER_REPLACEMENT",
    "performed_on": "2026-04-26",
    "result": "FILTER_REPLACED",
    "note": "합성 filter_replacement 이력",
    "data_classification": "synthetic"
  },
  {
    "care_history_id": "d8f298f5-df81-5164-be2d-d184fd697f21",
    "customer_product_id": "59c7bff8-8c66-574e-83c5-9f8f755dd9e1",
    "care_type": "REGULAR_INSPECTION",
    "performed_on": "2026-03-19",
    "result": "NORMAL",
    "note": "합성 regular_inspection 이력",
    "data_classification": "synthetic"
  },
  {
    "care_history_id": "1db70694-e500-5cf2-9f5d-55b2f464fde0",
    "customer_product_id": "59c7bff8-8c66-574e-83c5-9f8f755dd9e1",
    "care_type": "FILTER_REPLACEMENT",
    "performed_on": "2026-05-03",
    "result": "FILTER_REPLACED",
    "note": "합성 filter_replacement 이력",
    "data_classification": "synthetic"
  },
  {
    "care_history_id": "3a3efc8d-17e2-57e4-930b-47c330810c89",
    "customer_product_id": "dfc9cf8f-eff3-55d9-a366-06c7d5eff3e4",
    "care_type": "REGULAR_INSPECTION",
    "performed_on": "2026-03-26",
    "result": "NORMAL",
    "note": "합성 regular_inspection 이력",
    "data_classification": "synthetic"
  },
  {
    "care_history_id": "df95f255-e335-56f8-9e1f-70183bc23637",
    "customer_product_id": "dfc9cf8f-eff3-55d9-a366-06c7d5eff3e4",
    "care_type": "FILTER_REPLACEMENT",
    "performed_on": "2026-05-10",
    "result": "FILTER_REPLACED",
    "note": "합성 filter_replacement 이력",
    "data_classification": "synthetic"
  },
  {
    "care_history_id": "09b23e60-c774-5d5d-b0fa-7991e5f13585",
    "customer_product_id": "f2a54705-6525-54ea-aac7-6ee819c8a54c",
    "care_type": "REGULAR_INSPECTION",
    "performed_on": "2026-04-02",
    "result": "NORMAL",
    "note": "합성 regular_inspection 이력",
    "data_classification": "synthetic"
  },
  {
    "care_history_id": "f7f32ee5-9539-5f0b-a82a-403e84253cdf",
    "customer_product_id": "f2a54705-6525-54ea-aac7-6ee819c8a54c",
    "care_type": "FILTER_REPLACEMENT",
    "performed_on": "2026-05-17",
    "result": "FILTER_REPLACED",
    "note": "합성 filter_replacement 이력",
    "data_classification": "synthetic"
  },
  {
    "care_history_id": "0d74852d-207a-5387-b89e-5ac96b93b6c2",
    "customer_product_id": "6f5f486f-6c89-5bb0-a952-adda1265e794",
    "care_type": "REGULAR_INSPECTION",
    "performed_on": "2026-04-09",
    "result": "NORMAL",
    "note": "합성 regular_inspection 이력",
    "data_classification": "synthetic"
  },
  {
    "care_history_id": "cd0b66bd-d0b0-542d-ac2e-dde4ba82191a",
    "customer_product_id": "6f5f486f-6c89-5bb0-a952-adda1265e794",
    "care_type": "FILTER_REPLACEMENT",
    "performed_on": "2026-05-24",
    "result": "FILTER_REPLACED",
    "note": "합성 filter_replacement 이력",
    "data_classification": "synthetic"
  },
  {
    "care_history_id": "bdb690ff-d3bb-520a-8fed-83aff3087288",
    "customer_product_id": "f8065aba-04af-541c-a383-972eed605959",
    "care_type": "REGULAR_INSPECTION",
    "performed_on": "2026-04-16",
    "result": "NORMAL",
    "note": "합성 regular_inspection 이력",
    "data_classification": "synthetic"
  },
  {
    "care_history_id": "884be4c3-83ff-5f44-9135-7f9d603274ed",
    "customer_product_id": "f8065aba-04af-541c-a383-972eed605959",
    "care_type": "FILTER_REPLACEMENT",
    "performed_on": "2026-05-31",
    "result": "FILTER_REPLACED",
    "note": "합성 filter_replacement 이력",
    "data_classification": "synthetic"
  },
  {
    "care_history_id": "3e6c8166-37f7-50c1-b65a-b27c90e192cd",
    "customer_product_id": "a95b6795-4156-567c-8f8b-a02c15bce1ea",
    "care_type": "REGULAR_INSPECTION",
    "performed_on": "2026-04-23",
    "result": "NORMAL",
    "note": "합성 regular_inspection 이력",
    "data_classification": "synthetic"
  },
  {
    "care_history_id": "2025a37f-7c9e-5e50-9322-c0c436bd550b",
    "customer_product_id": "a95b6795-4156-567c-8f8b-a02c15bce1ea",
    "care_type": "FILTER_REPLACEMENT",
    "performed_on": "2026-06-07",
    "result": "FILTER_REPLACED",
    "note": "합성 filter_replacement 이력",
    "data_classification": "synthetic"
  },
  {
    "care_history_id": "9d75172a-efda-5c1b-b76d-09c3f4e256b0",
    "customer_product_id": "7db31abc-9666-58c6-b5df-7ae71da240d8",
    "care_type": "REGULAR_INSPECTION",
    "performed_on": "2026-04-30",
    "result": "NORMAL",
    "note": "합성 regular_inspection 이력",
    "data_classification": "synthetic"
  },
  {
    "care_history_id": "c399a585-055c-57ec-95c8-7b6389c19437",
    "customer_product_id": "7db31abc-9666-58c6-b5df-7ae71da240d8",
    "care_type": "FILTER_REPLACEMENT",
    "performed_on": "2026-06-14",
    "result": "FILTER_REPLACED",
    "note": "합성 filter_replacement 이력",
    "data_classification": "synthetic"
  },
  {
    "care_history_id": "3a71b4b1-a232-5cc7-848c-0e7118cb0b43",
    "customer_product_id": "522206a8-6c10-5eb2-b709-067bbf3a99a4",
    "care_type": "REGULAR_INSPECTION",
    "performed_on": "2026-05-07",
    "result": "NORMAL",
    "note": "합성 regular_inspection 이력",
    "data_classification": "synthetic"
  },
  {
    "care_history_id": "7294bae6-2d14-569c-8c60-1934462a772f",
    "customer_product_id": "522206a8-6c10-5eb2-b709-067bbf3a99a4",
    "care_type": "FILTER_REPLACEMENT",
    "performed_on": "2026-06-21",
    "result": "FILTER_REPLACED",
    "note": "합성 filter_replacement 이력",
    "data_classification": "synthetic"
  },
  {
    "care_history_id": "1ffc5eb2-8f6f-5208-a9f6-86c9be1b90f5",
    "customer_product_id": "5134f121-c503-5ef4-9b1a-bf2653d71530",
    "care_type": "REGULAR_INSPECTION",
    "performed_on": "2026-05-14",
    "result": "NORMAL",
    "note": "합성 regular_inspection 이력",
    "data_classification": "synthetic"
  },
  {
    "care_history_id": "407156c4-7181-5667-ab23-d67be65a4dee",
    "customer_product_id": "5134f121-c503-5ef4-9b1a-bf2653d71530",
    "care_type": "FILTER_REPLACEMENT",
    "performed_on": "2026-06-28",
    "result": "FILTER_REPLACED",
    "note": "합성 filter_replacement 이력",
    "data_classification": "synthetic"
  },
  {
    "care_history_id": "7d84d422-35b7-5b7d-8993-b05777bf68dc",
    "customer_product_id": "e8e9bca4-a0a2-53e4-8cdd-dac2415a8074",
    "inquiry_id": "bcb70ef6-01ac-5e0e-8a8d-fe5af43e8bde",
    "visit_id": "15a7b744-e99e-5fd6-bc96-9c1e6d01c1e5",
    "care_type": "VISIT_SERVICE",
    "performed_on": "2026-07-04",
    "result": "ISSUE_RESOLVED",
    "note": "합성 방문 점검: 필터 체결 상태와 출수 유로 정비 후 출수량 정상화 확인",
    "data_classification": "synthetic"
  }
]
